{
  "schema_version": "1.0",
  "version": "0.1.0",
  "evidence_status": "exploratory_case_review",
  "limitations": [
    "由本地案例观察提炼的初始设计配方，非验证过的科学分类。",
    "99 张截图不是 99 个独立案例；角色、配对与泛化效果尚未核实。"
  ],
  "dimensions": [
    {
      "id": "linearity",
      "name": "线条",
      "anchors": {
        "1": "圆弧、柔和转折",
        "3": "直曲混合",
        "5": "直线、明确转折"
      }
    },
    {
      "id": "structure",
      "name": "结构",
      "anchors": {
        "1": "松弛、流动轮廓",
        "3": "部分收束",
        "5": "轮廓受控、结构明确"
      }
    },
    {
      "id": "contrast",
      "name": "明暗对比",
      "anchors": {
        "1": "近脸元素明暗差较小",
        "3": "有一个对比焦点",
        "5": "多个近脸元素明暗差较大"
      }
    },
    {
      "id": "depth",
      "name": "色彩深浅",
      "anchors": {
        "1": "造型以浅色为主",
        "3": "深浅混合",
        "5": "造型以深色为主"
      }
    },
    {
      "id": "chroma",
      "name": "鲜艳度",
      "anchors": {
        "1": "灰调、低饱和",
        "3": "适中饱和",
        "5": "鲜艳、强色彩焦点"
      }
    },
    {
      "id": "ornament",
      "name": "装饰量",
      "anchors": {
        "1": "少装饰、简洁边界",
        "3": "一个可见装饰焦点",
        "5": "多处装饰、纹样或复杂细节"
      }
    },
    {
      "id": "finish",
      "name": "修饰精度",
      "anchors": {
        "1": "保留自然纹理、低整理感",
        "3": "局部精修",
        "5": "发丝、妆容边界与搭配高度整理"
      }
    }
  ],
  "styles": [
    {
      "id": "sweet",
      "name": "甜美系",
      "kind": "family",
      "definition": "用柔和弧度、轻盈细节和适度色彩焦点营造清甜的造型效果；不意味着年龄小或性格甜美。",
      "cues": [
        "薄刘海与弧度",
        "柔和色彩焦点",
        "少量花饰或小配饰"
      ],
      "ranges": {
        "linearity": [
          1,
          2
        ],
        "structure": [
          1,
          3
        ],
        "contrast": [
          1,
          3
        ],
        "depth": [
          1,
          3
        ],
        "chroma": [
          2,
          4
        ],
        "ornament": [
          2,
          4
        ],
        "finish": [
          2,
          4
        ]
      },
      "plan": {
        "hair": [
          "先试轻薄分缝或卷出脸周弧度；发长按个人偏好保留",
          "对比露额与轻薄刘海，不预设厚刘海适合所有人"
        ],
        "makeup": [
          "可选柔和腮红与模糊唇缘，选择一个色彩焦点",
          "保留真实肤色；不靠扩大眼睛或缩小五官实现甜感"
        ],
        "outfit": [
          "从柔和领口、轻盈针织或小面积细节试起",
          "用现有衣物试近脸浅色/中浅色，不要求全身粉色"
        ]
      },
      "cautions": [
        "装饰过多可能抢走面部焦点；可以减量",
        "不喜欢可爱元素时可转柔和配方"
      ],
      "families": []
    },
    {
      "id": "soft",
      "name": "柔和系",
      "kind": "family",
      "definition": "以低至中等对比、连续弧线和流动材质协调近脸视觉，可不包含任何可爱装饰。",
      "cues": [
        "连续脸周弧度",
        "妆容边界柔化",
        "柔软或垂坠材质"
      ],
      "ranges": {
        "linearity": [
          1,
          3
        ],
        "structure": [
          1,
          3
        ],
        "contrast": [
          1,
          3
        ],
        "depth": [
          1,
          4
        ],
        "chroma": [
          1,
          3
        ],
        "ornament": [
          1,
          3
        ],
        "finish": [
          1,
          4
        ]
      },
      "plan": {
        "hair": [
          "保留自然层次，先用吹整形成脸周弧线",
          "细软发避免未经评估就大量打薄；卷度以自述发质调整"
        ],
        "makeup": [
          "可选降低眉眼与唇部边缘的突兀对比",
          "不通过泛白底妆制造柔和，保留肤色差异"
        ],
        "outfit": [
          "试柔和领口、垂坠或细针织材质",
          "近脸配色先从低到中等对比试验"
        ]
      },
      "cautions": [
        "低对比不等于无重点，保留一个细节焦点",
        "需要更利落时可增加局部结构"
      ],
      "families": []
    },
    {
      "id": "dignified",
      "name": "端庄大气系",
      "kind": "family",
      "definition": "以稳定轮廓、清楚的近脸留白和克制细节构成有分量的整体造型；不是社会地位或年龄判断。",
      "cues": [
        "整洁侧分或收束发型",
        "稳定领口和肩部轮廓",
        "克制配饰与明确妆容焦点"
      ],
      "ranges": {
        "linearity": [
          2,
          5
        ],
        "structure": [
          3,
          5
        ],
        "contrast": [
          2,
          5
        ],
        "depth": [
          2,
          5
        ],
        "chroma": [
          1,
          4
        ],
        "ornament": [
          1,
          3
        ],
        "finish": [
          3,
          5
        ]
      },
      "plan": {
        "hair": [
          "先试低盘发、耳后收束或整洁侧分，保留合适蓬松度",
          "如需剪发，把层次、长度与本人发质交给理发师一起评估"
        ],
        "makeup": [
          "可选清晰但不过度生硬的眉形与一个唇妆焦点",
          "大地色或红唇都是可选试验，不是必须浓妆"
        ],
        "outfit": [
          "试简洁领口、较稳定的面料和适度结构",
          "配饰少而明确；不以价格、品牌或真实财富定义质感"
        ]
      },
      "cautions": [
        "结构太硬可能失去用户希望的松弛感",
        "正式配方应按学校、职场或休闲场景调整"
      ],
      "families": []
    },
    {
      "id": "cool",
      "name": "清冷系",
      "kind": "family",
      "definition": "以简洁边界、受控线条和较少装饰营造克制清晰的造型；不等于冷肤色、不亲切或某种性格。",
      "cues": [
        "干净分缝与发型线条",
        "少装饰",
        "近脸配色克制"
      ],
      "ranges": {
        "linearity": [
          3,
          5
        ],
        "structure": [
          3,
          5
        ],
        "contrast": [
          2,
          5
        ],
        "depth": [
          1,
          5
        ],
        "chroma": [
          1,
          3
        ],
        "ornament": [
          1,
          2
        ],
        "finish": [
          2,
          5
        ]
      },
      "plan": {
        "hair": [
          "先试干净中分或偏分、耳后收束和少量顺直纹理",
          "短发只是选项；可保留长发而减少碎乱线条"
        ],
        "makeup": [
          "可选明确眉眼焦点与克制唇色",
          "少装饰不等于无妆，也不要求冷白肤色"
        ],
        "outfit": [
          "试简洁领口、连续色块和减少配饰",
          "黑白灰并非唯一方案，可用用户喜欢的低饱和色"
        ]
      },
      "cautions": [
        "过于受控可能不符合日常维护时间",
        "想增加温和焦点时可试甜酷或柔和清冷混合"
      ],
      "families": []
    },
    {
      "id": "polished",
      "name": "轻熟系",
      "kind": "family",
      "definition": "把整洁线条、适度弧度与精致细节结合为日常可穿的轻精致配方；不推断用户真实年龄。",
      "cues": [
        "柔和侧分或受控波纹",
        "局部精致焦点",
        "日常结构与垂坠结合"
      ],
      "ranges": {
        "linearity": [
          2,
          4
        ],
        "structure": [
          2,
          4
        ],
        "contrast": [
          2,
          4
        ],
        "depth": [
          2,
          4
        ],
        "chroma": [
          1,
          4
        ],
        "ornament": [
          1,
          3
        ],
        "finish": [
          3,
          5
        ]
      },
      "plan": {
        "hair": [
          "试侧分、柔和波纹或锁骨附近轮廓；也可保留当前长度",
          "控制卷度与吹整时间，不把大波浪设为硬要求"
        ],
        "makeup": [
          "可选轻薄底妆与适度清晰的眉唇边界",
          "用自选唇色形成重点，不强制浓妆"
        ],
        "outfit": [
          "试干净衬衫领口、适度垂坠与少量配饰",
          "衣物以现有衣橱组合，不预设用户身材"
        ]
      },
      "cautions": [
        "精修感有维护成本",
        "不想成熟表达时保留自然纹理与休闲单品"
      ],
      "families": []
    },
    {
      "id": "korean",
      "name": "韩系",
      "kind": "expression",
      "definition": "本目录用轻透层次、整理感与适量精致细节作为韩系表达示例，可叠加多个基础风格；不推断国籍。",
      "cues": [
        "轻薄脸周层次",
        "边界柔和但整理度高",
        "简洁配色"
      ],
      "ranges": {
        "linearity": [
          1,
          4
        ],
        "structure": [
          2,
          4
        ],
        "contrast": [
          1,
          4
        ],
        "depth": [
          1,
          5
        ],
        "chroma": [
          1,
          4
        ],
        "ornament": [
          1,
          3
        ],
        "finish": [
          3,
          5
        ]
      },
      "plan": {
        "hair": [
          "试轻薄脸周层次或自然分缝，不要求空气刘海",
          "高整理感先以临时吹整测试维护成本"
        ],
        "makeup": [
          "可选轻透、局部精细的眉眼与唇妆",
          "底妆匹配真实肤色，不强制提亮"
        ],
        "outfit": [
          "试简洁基础款与局部精致配饰",
          "按主风格调整颜色和轮廓"
        ]
      },
      "cautions": [
        "是有限配方示例，不代表所有韩国审美"
      ],
      "families": []
    },
    {
      "id": "japanese",
      "name": "日系",
      "kind": "expression",
      "definition": "本目录用自然纹理、轻盈层次与少量生活感细节作为日系表达示例，可甜美也可清冷；不推断国籍。",
      "cues": [
        "可见自然纹理",
        "轻盈层次",
        "松弛搭配"
      ],
      "ranges": {
        "linearity": [
          1,
          4
        ],
        "structure": [
          1,
          3
        ],
        "contrast": [
          1,
          4
        ],
        "depth": [
          1,
          5
        ],
        "chroma": [
          1,
          4
        ],
        "ornament": [
          1,
          4
        ],
        "finish": [
          1,
          3
        ]
      },
      "plan": {
        "hair": [
          "试自然纹理、轻层次或松弛分缝",
          "是否留刘海取决于发旋、发质与用户意愿"
        ],
        "makeup": [
          "可选薄妆和一个柔和色彩重点",
          "不追求统一模板的眼形或脸型"
        ],
        "outfit": [
          "试已有基础款的柔和叠穿和适度细节",
          "避免仅凭脸照规定宽松程度或身材比例"
        ]
      },
      "cautions": [
        "自然感也可能需要打理，应先说明实际步骤"
      ],
      "families": []
    },
    {
      "id": "sweet-cool",
      "name": "甜酷",
      "kind": "recipe",
      "definition": "保留一个柔和或鲜明焦点，再叠加利落线条和简洁结构；甜与酷不必互相排斥。",
      "cues": [
        "柔和焦点与结构对照"
      ],
      "ranges": {
        "linearity": [
          2,
          4
        ],
        "structure": [
          3,
          5
        ],
        "contrast": [
          3,
          5
        ],
        "depth": [
          2,
          5
        ],
        "chroma": [
          1,
          4
        ],
        "ornament": [
          1,
          3
        ],
        "finish": [
          2,
          5
        ]
      },
      "plan": {
        "hair": [
          "先试利落分缝，保留少量柔和脸周发丝"
        ],
        "makeup": [
          "可选一个唇/腮红焦点，减少其他部位叠加"
        ],
        "outfit": [
          "用简洁外套与柔和内搭形成对照"
        ]
      },
      "cautions": [
        "避免一次叠加太多强元素"
      ],
      "families": [
        "sweet",
        "cool"
      ]
    },
    {
      "id": "french-soft",
      "name": "柔和法式",
      "kind": "recipe",
      "definition": "在柔和基础上保留可见发丝纹理和少量复古细节，强调不完全对称的松弛表达。",
      "cues": [
        "松弛纹理与柔和边界"
      ],
      "ranges": {
        "linearity": [
          1,
          3
        ],
        "structure": [
          1,
          3
        ],
        "contrast": [
          2,